{
  "$schema": "http://json-schema.org/draft-07/schema#",
  "$id": "https://cira-quantum.org/schemas/cqm_v1.json",
  "title": "CQM JSON (v1)",
  "description": "Contract between formulation providers (LLMs) and the solver pipeline. Every CQM the platform consumes — whether produced by Claude, OpenAI, a local LLM, or a hand-written test fixture — conforms to this schema.",
  "type": "object",
  "required": ["version", "variables", "objective", "constraints"],
  "additionalProperties": false,
  "properties": {
    "version": {
      "type": "string",
      "enum": ["1"],
      "description": "Schema version. Must be \"1\"."
    },
    "description": {
      "type": "string",
      "description": "Optional human description of the model. Carried through but not used by the compiler."
    },
    "variables": {
      "type": "array",
      "minItems": 1,
      "items": { "$ref": "#/definitions/variable" },
      "description": "All decision variables. Names must be unique."
    },
    "objective": { "$ref": "#/definitions/objective" },
    "constraints": {
      "type": "array",
      "items": { "$ref": "#/definitions/constraint" },
      "description": "May be empty (unconstrained problem). Constraint labels should be unique."
    },
    "test_instance": { "$ref": "#/definitions/test_instance" }
  },
  "definitions": {
    "variable": {
      "type": "object",
      "required": ["name", "type"],
      "additionalProperties": false,
      "properties": {
        "name": {
          "type": "string",
          "minLength": 1,
          "description": "Stable variable identifier. Must match every reference in objective.linear/quadratic and constraints.*.linear/quadratic."
        },
        "type": {
          "type": "string",
          "enum": ["binary", "integer", "real"]
        },
        "lower_bound": {
          "type": "number",
          "description": "Required for integer and real variables. Ignored for binary."
        },
        "upper_bound": {
          "type": "number",
          "description": "Required for integer and real variables. Ignored for binary."
        },
        "description": {
          "type": "string",
          "description": "Human-readable explanation. Echoed into the variable_registry by the compiler."
        }
      },
      "allOf": [
        {
          "if":   { "properties": { "type": { "const": "integer" } } },
          "then": { "required": ["lower_bound", "upper_bound"] }
        },
        {
          "if":   { "properties": { "type": { "const": "real" } } },
          "then": { "required": ["lower_bound", "upper_bound"] }
        }
      ]
    },
    "objective": {
      "type": "object",
      "required": ["sense", "linear", "quadratic"],
      "additionalProperties": false,
      "properties": {
        "sense": {
          "type": "string",
          "enum": ["minimize", "maximize"]
        },
        "linear": {
          "type": "object",
          "additionalProperties": { "type": "number" },
          "description": "Map from variable name to its linear coefficient. Empty object is allowed."
        },
        "quadratic": {
          "type": "object",
          "additionalProperties": { "type": "number" },
          "description": "Map from \"u*v\" string keys (a single * delimiter, no spaces) to coefficients. Empty object is allowed."
        },
        "offset": {
          "type": "number",
          "description": "Optional constant term added to the objective. Useful for natural-form encodings whose raw quadratic body is shifted from the user-facing target (e.g. number partitioning's squared-imbalance form has an implicit -S² constant that makes the perfect-partition optimum read as 0 when this offset is set to +S²). Absent = 0."
        }
      }
    },
    "constraint": {
      "type": "object",
      "required": ["label", "type", "linear", "quadratic", "rhs"],
      "additionalProperties": false,
      "properties": {
        "label": {
          "type": "string",
          "minLength": 1,
          "description": "Stable constraint identifier. Used in the validation harness's per-constraint coverage report."
        },
        "type": {
          "type": "string",
          "enum": ["equality", "inequality_le", "inequality_ge"],
          "description": "Sense of the constraint. equality => lhs == rhs; inequality_le => lhs <= rhs; inequality_ge => lhs >= rhs."
        },
        "linear": {
          "type": "object",
          "additionalProperties": { "type": "number" }
        },
        "quadratic": {
          "type": "object",
          "additionalProperties": { "type": "number" }
        },
        "rhs": {
          "type": "number"
        }
      }
    },
    "test_instance": {
      "type": "object",
      "additionalProperties": false,
      "properties": {
        "description": { "type": "string" },
        "expected_optimum": {
          "type": ["number", "null"],
          "description": "User-facing optimum (or best-known value). Always in the units of the objective sense (i.e. for maximize problems, the maximum value, not its negation). null when no ground truth exists."
        }
      }
    }
  }
}
